{
  "v": 1,
  "type": "transfer",
  "tx_hash": "0x3084a3441712e1882e0c97271c0dced5a3cc8587b0bfde729c97b5b2a0f80df9",
  "log_index": 1,
  "block_number": 18234,
  "ts": 1791799264000,
  "data": {
    "token": "AIR",
    "from": "0x391887cbcf922e19d672df700739c4a3c74e35ee",
    "to": "0x15321b2a448f1eb660bbe224ec373b7b533c4159",
    "amount": "100000000000000000"
  }
}
