{
  "v": 1,
  "type": "trade",
  "tx_hash": "0x256e7141d2ee5429d4ed0aa624d5af40e1893c81d3ddaf4088c3a03fd7a8d6fe",
  "log_index": 2,
  "block_number": 18234,
  "ts": 1791799264000,
  "data": {
    "listing_id": 4,
    "seller": "0x391887cbcf922e19d672df700739c4a3c74e35ee",
    "buyer": "0x85b0ad1884ce982053e025b3baca13b830ed3be5",
    "amount_air": "1000000000000000000",
    "price_tinr": "25000000000000000000"
  }
}
